<!-- 复合元素 -->
<!-- 混合 -->
<note xmlns="http://www.w3schools.com" xmlns:xsi="http://www.w3.org/2001/XMLSchema-instance" xsi:schemaLocation="http://www.w3schools.com test9.xsd">
  <letter>
    Dear Mr.
    <name>John Smith</name>.
    Your order 
    <orderid>1032</orderid>
    will be shipped on 
    <shipdate>2001-07-13</shipdate>. 
  </letter>
  
  <letter2>
    Dear Mr.
    <name>Zhao Si</name>.
    Your order 
    <orderid>1032</orderid>
    will be shipped on 
    <shipdate>2001-07-13</shipdate>. 
  </letter2>

</note>